{
    "cveId": "CVE-2021-24000",
    "version": "1.0.0",
    "timestamp": "2024-11-03T18:37:50.907685+00:00",
    "description": "A race condition with requestPointerLock() and setTimeout() could have resulted in a user interacting with one tab when they believed they were on a separate tab. In conjunction with certain elements (such as &ltinput type=file&gt) this could have led to an attack where a user was confused about the origin of the webpage and potentially disclosed information they did not intend to. This vulnerability affects Firefox < 88.",
    "keyphrases": {
        "rootcause": "race condition",
        "weakness": "",
        "impact": "disclose information",
        "vector": "",
        "attacker": "",
        "product": "Firefox",
        "version": "< 88",
        "component": ""
    },
    "mitreTechnicalImpacts": [
        "Read data"
    ]
}
