{
  "cveId": "CVE-2017-14369",
  "version": "1.0.0",
  "timestamp": "2024-12-11T16:08:24.783251+00:00",
  "description": "RSA Archer GRC Platform prior to 6.2.0.5 is affected by a privilege escalation vulnerability. A low privileged RSA Archer user may potentially exploit this vulnerability to elevate their privileges and export certain application records.",
  "keyphrases": {
    "rootcause": "",
    "weakness": "privilege escalation vulnerability",
    "impact": "privilege escalation",
    "vector": "",
    "attacker": "low privileged RSA Archer user",
    "product": "RSA Archer GRC Platform",
    "version": "prior to 6.2.0.5",
    "component": ""
  },
  "mitreTechnicalImpacts": []
}