{
  "cveId": "CVE-2007-0133",
  "version": "1.0.0",
  "timestamp": "2024-12-10T17:54:04.992951+00:00",
  "description": "Multiple SQL injection vulnerabilities in display_review.php in iGeneric iG Shop 1.4 and earlier allow remote attackers to execute arbitrary SQL commands via the (1) id or (2) user_login_cookie parameter.",
  "keyphrases": {
    "rootcause": "",
    "weakness": "SQL injection vulnerabilities",
    "impact": "execute arbitrary SQL commands",
    "vector": "",
    "attacker": "remote attackers",
    "product": "iGeneric iG Shop",
    "version": "1.4 and earlier",
    "component": "display_review.php"
  },
  "mitreTechnicalImpacts": []
}