{
  "cveId": "CVE-2013-0754",
  "version": "1.0.0",
  "timestamp": "2024-12-10T17:54:04.992951+00:00",
  "description": "Use-after-free vulnerability in the ListenerManager implementation in Mozilla Firefox before 18.0, Firefox ESR 10.x before 10.0.12 and 17.x before 17.0.2, Thunderbird before 17.0.2, Thunderbird ESR 10.x before 10.0.12 and 17.x before 17.0.2, and SeaMonkey before 2.15 allows remote attackers to execute arbitrary code via vectors involving the triggering of garbage collection after memory allocation for listener objects.",
  "keyphrases": {
    "rootcause": "Use-after-free vulnerability",
    "weakness": "Use-after-free",
    "impact": "execute arbitrary code",
    "vector": "triggering of garbage collection after memory allocation for listener objects",
    "attacker": "remote attackers",
    "product": [
      "['Mozilla Firefox'",
      "'Firefox ESR'",
      "'Thunderbird'",
      "'Thunderbird ESR'",
      "'SeaMonkey']"
    ],
    "version": "various versions before specific releases",
    "component": "ListenerManager implementation"
  },
  "mitreTechnicalImpacts": []
}