{
  "cveId": "CVE-2024-32167",
  "version": "1.0.0",
  "timestamp": "2024-12-06T11:32:07.789868+00:00",
  "description": "Sourcecodester Online Medicine Ordering System 1.0 is vulnerable to Arbitrary file deletion vulnerability as the backend settings have the function of deleting pictures to delete any files.",
  "keyphrases": {
    "rootcause": "",
    "weakness": "arbitrary file deletion",
    "impact": [
      "Arbitrary file deletion",
      "delete any files"
    ],
    "vector": "",
    "attacker": "",
    "product": "Sourcecodester Online Medicine Ordering System",
    "version": "1",
    "component": "backend settings"
  },
  "mitreTechnicalImpacts": []
}