{
  "cveId": "CVE-2023-46814",
  "version": "1.0.0",
  "timestamp": "2024-12-06T11:32:07.789868+00:00",
  "description": "A binary hijacking vulnerability exists within the VideoLAN VLC media player before 3.0.19 on Windows. The uninstaller attempts to execute code with elevated privileges out of a standard user writable location. Standard users may use this to gain arbitrary code execution as SYSTEM.",
  "keyphrases": {
    "rootcause": "",
    "weakness": "binary hijacking",
    "impact": [
      "arbitrary code execution as SYSTEM",
      "execute code with elevated privileges"
    ],
    "vector": "",
    "attacker": "Standard users",
    "product": "VideoLAN VLC media player",
    "version": "before 3.0.19",
    "component": "uninstaller on Windows"
  },
  "mitreTechnicalImpacts": []
}