{
    "cveId": "CVE-2022-21678",
    "version": "1.0.0",
    "timestamp": "2024-11-03T18:37:50.907685+00:00",
    "description": "Discourse is an open source discussion platform. Prior to version 2.8.0.beta11 in the `tests-passed` branch, version 2.8.0.beta11 in the `beta` branch, and version 2.7.13 in the `stable` branch, the bios of users who made their profiles private were still visible in the `` tags on their users pages. The problem is patched in `tests-passed` version 2.8.0.beta11, `beta` version 2.8.0.beta11, and `stable` version 2.7.13 of Discourse.",
    "keyphrases": {
        "rootcause": "",
        "weakness": "information disclosure",
        "impact": "",
        "vector": "",
        "attacker": "",
        "product": "Discourse",
        "version": "prior to 2.8.0.beta11 in tests-passed branch, 2.8.0.beta11 in beta branch, and 2.7.13 in stable branch",
        "component": ""
    },
    "mitreTechnicalImpacts": []
}
