{
  "cveId": "CVE-2017-10615",
  "version": "1.0.0",
  "timestamp": "2024-12-11T16:08:24.783251+00:00",
  "description": "A vulnerability in the pluggable authentication module (PAM) of Juniper Networks Junos OS may allow an unauthenticated network based attacker to potentially execute arbitrary code or crash daemons such as telnetd or sshd that make use of PAM. Affected Juniper Networks Junos OS releases are 14.1 from 14.1R5 prior to 14.1R8-S4, 14.1R9 14.1X53 prior to 14.1X53-D50 on EX and QFX series 14.2 from 14.2R3 prior to 14.2R7-S8, 14.2R8 No other Junos OS releases are affected by this issue. No other Juniper Networks products are affected by this issue.",
  "keyphrases": {
    "rootcause": "",
    "weakness": "",
    "impact": [
      "crash daemons",
      "potentially execute arbitrary code"
    ],
    "vector": "",
    "attacker": "unauthenticated network based attacker",
    "product": "Juniper Networks Junos OS",
    "version": [
      "14.1 from 14.1R5 to 14.1R8-S4",
      "14.1R9 14.1X53 to 14.1X53-D50 on EX and QFX series",
      "14.2 from 14.2R3 to 14.2R7-S8",
      "14.2R8"
    ],
    "component": "pluggable authentication module (PAM)"
  },
  "mitreTechnicalImpacts": []
}