{
  "cveId": "CVE-2017-0601",
  "version": "1.0.0",
  "timestamp": "2024-12-11T16:08:24.783251+00:00",
  "description": "An Elevation of Privilege vulnerability in Bluetooth could potentially enable a local malicious application to accept harmful files shared via bluetooth without user permission. This issue is rated as Moderate due to local bypass of user interaction requirements. Product Android. Versions 7.0, 7.1.1, 7.1.2. Android ID A-35258579.",
  "keyphrases": {
    "rootcause": "",
    "weakness": "bypass of user interaction requirements",
    "impact": [
      "Elevation of Privilege",
      "accept harmful files shared via bluetooth without user permission"
    ],
    "vector": "",
    "attacker": "local malicious application",
    "product": "Android",
    "version": [
      "7.0",
      "7.1.1",
      "7.1.2"
    ],
    "component": "Bluetooth"
  },
  "mitreTechnicalImpacts": []
}