{
  "cveId": "CVE-2008-4401",
  "version": "1.0.0",
  "timestamp": "2024-12-10T17:54:04.992951+00:00",
  "description": "ActionScript in Adobe Flash Player 9.0.124.0 and earlier does not require user interaction in conjunction with (1) the FileReference.browse operation in the FileReference upload API or (2) the FileReference.download operation in the FileReference download API, which allows remote attackers to create a browse dialog box, and possibly have unspecified other impact, via an SWF file.",
  "keyphrases": {
    "rootcause": "",
    "weakness": "",
    "impact": [
      "create browse dialog box",
      "possibly have unspecified other impact"
    ],
    "vector": "SWF file",
    "attacker": "remote attackers",
    "product": "Adobe Flash Player",
    "version": "9.0.124.0 and earlier",
    "component": [
      "ActionScript",
      "FileReference upload/download API"
    ]
  },
  "mitreTechnicalImpacts": []
}