{
  "cveId": "CVE-2011-5230",
  "version": "1.0.0",
  "timestamp": "2024-12-10T17:54:04.992951+00:00",
  "description": "Multiple SQL injection vulnerabilities in the selectUserIdByLoginPass function in seotoaster_core/application/models/LoginModel.php in Seotoaster 1.9 and earlier allow remote attackers to execute arbitrary SQL commands via the (1) login parameter to sys/login/index or (2) memberLoginName parameter to sys/login/member.",
  "keyphrases": {
    "rootcause": "SQL injection vulnerabilities in the selectUserIdByLoginPass function",
    "weakness": "SQL injection vulnerabilities",
    "impact": "execute arbitrary SQL commands",
    "vector": [
      "login parameter",
      "memberLoginName parameter"
    ],
    "attacker": "remote attackers",
    "product": "Seotoaster",
    "version": "1.9 and earlier",
    "component": "seotoaster_core/application/models/LoginModel.php"
  },
  "mitreTechnicalImpacts": []
}