{
  "cveId": "CVE-2020-5393",
  "version": "1.0.0",
  "timestamp": "2024-12-12T22:08:52.294043+00:00",
  "description": "In Appspace On-Prem through 7.1.3, an adversary can steal a session token via XSS.",
  "keyphrases": {
    "rootcause": "cross-site scripting",
    "weakness": "XSS",
    "impact": "session token theft",
    "vector": "",
    "attacker": "adversary",
    "product": "Appspace On-Prem",
    "version": "through 7.1.3",
    "component": ""
  },
  "mitreTechnicalImpacts": []
}