{
  "cveId": "CVE-2023-6098",
  "version": "1.0.0",
  "timestamp": "2024-12-06T11:32:07.789868+00:00",
  "description": "An XSS vulnerability has been discovered in ICS Business Manager affecting version 7.06.0028.7066. A remote attacker could send a specially crafted string exploiting the obdd_act parameter, allowing the attacker to steal an authenticated users session, and perform actions within the application.",
  "keyphrases": {
    "rootcause": "",
    "weakness": [
      "XSS vulnerability",
      "cross-site scripting"
    ],
    "impact": [
      "['session stealing'",
      "'perform actions']"
    ],
    "vector": "specially crafted string",
    "attacker": "remote attacker",
    "product": "ICS Business Manager",
    "version": "7.06.0028.7066",
    "component": "obdd_act parameter"
  },
  "mitreTechnicalImpacts": []
}