{
  "cveId": "CVE-2024-51913",
  "version": "1.0.0",
  "timestamp": "2024-12-17T08:36:27.567979+00:00",
  "description": "Improper Neutralization of Input During Web Page Generation (Cross-site Scripting) vulnerability in Mapme Mapme allows Stored XSS.This issue affects Mapme from n/a through 1.3.2.",
  "keyphrases": {
    "rootcause": "Improper Neutralization of Input During Web Page Generation",
    "weakness": [
      "XSS",
      "cross-site scripting"
    ],
    "impact": "Stored XSS",
    "vector": "",
    "attacker": "",
    "product": "Mapme Mapme",
    "version": "n/a through 1.3.2",
    "component": ""
  },
  "mitreTechnicalImpacts": []
}