{
  "cveId": "CVE-2002-1069",
  "version": "1.0.0",
  "timestamp": "2024-12-10T17:54:04.992951+00:00",
  "description": "The remote administration capability for the D-Link DI-804 router 4.68 allows remote attackers to bypass authentication and release DHCP addresses or obtain sensitive information via a direct web request to the pages (1) release.htm, (2) Device Status, or (3) Device Information.",
  "keyphrases": {
    "rootcause": "",
    "weakness": "",
    "impact": [
      "bypass authentication",
      "obtain sensitive information"
    ],
    "vector": "direct web request",
    "attacker": "remote attackers",
    "product": "D-Link DI-804 router",
    "version": "4.68",
    "component": "remote administration capability"
  },
  "mitreTechnicalImpacts": []
}