{
    "cveId": "CVE-2022-21947",
    "version": "1.0.0",
    "timestamp": "2024-11-03T18:37:50.907685+00:00",
    "description": "A Exposure of Resource to Wrong Sphere vulnerability in Rancher Desktop of SUSE allows attackers in the local network to connect to the Dashboard API (steve) to carry out arbitrary actions. This issue affects SUSE Rancher Desktop versions prior to V.",
    "keyphrases": {
        "rootcause": "Exposure of Resource to Wrong Sphere",
        "weakness": "",
        "impact": "carry out arbitrary actions",
        "vector": "",
        "attacker": "attackers in the local network",
        "product": "SUSE Rancher Desktop",
        "version": "prior to V",
        "component": "Dashboard API"
    },
    "mitreTechnicalImpacts": [
        "Execute unauthorized code or commands",
        "Modify data",
        "Read data"
    ]
}
