{
  "cveId": "CVE-2006-4966",
  "version": "1.0.0",
  "timestamp": "2024-12-10T17:54:04.992951+00:00",
  "description": "PHP remote file inclusion vulnerability in inc/ifunctions.php in chumpsoft phpQuestionnaire (phpQ) 3.12 allows remote attackers to execute arbitrary PHP code via a URL in the GLOBALS[phpQRootDir] parameter.",
  "keyphrases": {
    "rootcause": "",
    "weakness": "remote file inclusion",
    "impact": "execute arbitrary PHP code",
    "vector": "URL in GLOBALS[phpQRootDir] parameter",
    "attacker": "remote attackers",
    "product": "chumpsoft phpQuestionnaire (phpQ)",
    "version": "3.12",
    "component": "inc/ifunctions.php"
  },
  "mitreTechnicalImpacts": []
}