{
  "cveId": "CVE-2012-2800",
  "version": "1.0.0",
  "timestamp": "2024-12-10T17:54:04.992951+00:00",
  "description": "Unspecified vulnerability in the ff_ivi_process_empty_tile function in libavcodec/ivi_common.c in FFmpeg before 0.11, and Libav 0.7.x before 0.7.7 and 0.8.x before 0.8.4, has unknown impact and attack vectors in which the tile size ... mismatches parameters and triggers writing into a too small array.",
  "keyphrases": {
    "rootcause": "",
    "weakness": "write into a too small array",
    "impact": "unknown impact",
    "vector": "tile size mismatches parameters",
    "attacker": "",
    "product": [
      "['FFmpeg'",
      "'Libav']"
    ],
    "version": [
      "['before 0.11'",
      "'0.7.x before 0.7.7'",
      "'0.8.x before 0.8.4']"
    ],
    "component": "ff_ivi_process_empty_tile function in libavcodec/ivi_common.c"
  },
  "mitreTechnicalImpacts": []
}