{
  "cveId": "CVE-2014-2739",
  "version": "1.0.0",
  "timestamp": "2024-12-10T17:54:04.992951+00:00",
  "description": "The cma_req_handler function in drivers/infiniband/core/cma.c in the Linux kernel 3.14.x through 3.14.1 attempts to resolve an RDMA over Converged Ethernet (aka RoCE) address that is properly resolved within a different module, which allows remote attackers to cause a denial of service (incorrect pointer dereference and system crash) via crafted network traffic.",
  "keyphrases": {
    "rootcause": "incorrect pointer dereference",
    "weakness": "",
    "impact": [
      "denial of service",
      "system crash"
    ],
    "vector": "crafted network traffic",
    "attacker": "remote attackers",
    "product": "Linux kernel",
    "version": "3.14.x through 3.14.1",
    "component": "cma_req_handler function"
  },
  "mitreTechnicalImpacts": []
}