{
  "cveId": "CVE-2008-5075",
  "version": "1.0.0",
  "timestamp": "2024-12-10T17:54:04.992951+00:00",
  "description": "Multiple SQL injection vulnerabilities in E-Uploader Pro 1.0 (aka Uploader PRO), when magic_quotes_gpc is disabled, allow remote attackers to execute arbitrary SQL commands via the (1) id parameter to (a) img.php, (b) file.php, (c) mail.php, (d) thumb.php, (e) zip.php, and (f) zipit.php, and (2) the view parameter to (g) browser.php.",
  "keyphrases": {
    "rootcause": "",
    "weakness": "SQL injection vulnerabilities",
    "impact": "execute arbitrary SQL commands",
    "vector": "",
    "attacker": "remote attackers",
    "product": "E-Uploader Pro",
    "version": "1",
    "component": [
      "['img.php'",
      "'file.php'",
      "'mail.php'",
      "'thumb.php'",
      "'zip.php'",
      "'zipit.php'",
      "'browser.php']"
    ]
  },
  "mitreTechnicalImpacts": []
}