{
  "cveId": "CVE-2022-26763",
  "version": "1.0.0",
  "timestamp": "2024-11-03T18:37:50.907685+00:00",
  "description": "An out-of-bounds access issue was addressed with improved bounds checking. This issue is fixed in tvOS 15.5, iOS 15.5 and iPadOS 15.5, Security Update 2022-004 Catalina, watchOS 8.6, macOS Big Sur 11.6.6, macOS Monterey 12.4. A malicious application may be able to execute arbitrary code with system privileges.",
  "keyphrases": {
    "rootcause": "",
    "weakness": "out-of-bounds access",
    "impact": [
      "arbitrary code execution",
      "execute arbitrary code"
    ],
    "vector": "",
    "attacker": "malicious application",
    "product": [
      "['tvOS'",
      "'iOS'",
      "'iPadOS'",
      "'macOS'",
      "'watchOS']"
    ],
    "version": [
      "['15.5'",
      "'15.5'",
      "'15.5'",
      "'Big Sur 11.6.6'",
      "'Monterey 12.4'",
      "'8.6']"
    ],
    "component": ""
  },
  "mitreTechnicalImpacts": [
    "Execute unauthorized code or commands"
  ]
}