{
  "cveId": "CVE-2008-2198",
  "version": "1.0.0",
  "timestamp": "2024-12-10T17:54:04.992951+00:00",
  "description": "PHP remote file inclusion vulnerability in kmitaadmin/kmitat/htmlcode.php in Kmita Tellfriend 2.0 and earlier, when register_globals is enabled, allows remote attackers to execute arbitrary PHP code via a URL in the file parameter.",
  "keyphrases": {
    "rootcause": "PHP remote file inclusion",
    "weakness": "remote file inclusion",
    "impact": "execute arbitrary PHP code",
    "vector": "URL in file parameter",
    "attacker": "remote attackers",
    "product": "Kmita Tellfriend",
    "version": "2.0 and earlier",
    "component": "kmitaadmin/kmitat/htmlcode.php"
  },
  "mitreTechnicalImpacts": []
}