{
  "cveId": "CVE-2018-13475",
  "version": "1.0.0",
  "timestamp": "2024-12-12T22:08:52.294043+00:00",
  "description": "The mintToken function of a smart contract implementation for VSCToken, an Ethereum token, has an integer overflow that allows the owner of the contract to set the balance of an arbitrary user to any value.",
  "keyphrases": {
    "rootcause": "",
    "weakness": "integer overflow",
    "impact": "set balance of arbitrary user to any value",
    "vector": "",
    "attacker": "owner of contract",
    "product": "VSCToken",
    "version": "",
    "component": "mintToken function"
  },
  "mitreTechnicalImpacts": []
}